"metric","value","interpretation_scope"
"cancer_types","OVC;CEAD;CESC;UCEC","Representative IF image review"
"cases_per_cancer_type","1 each","One case per cancer type"
"total_cases","4","Four representative cases"
"total_rois","4","One ROI per representative case"
"total_dapi_nuclei_in_crop","1909","Raw nuclei counted in selected image crops"
"total_cd11c_hladra_apc_raw_count","108","Raw illustrative ROI count only"
"total_cd11c_hladra_lamp3_ccr7_regional_cooccurrence_raw_count","81","Raw illustrative ROI count only"
"density_and_fraction_reporting","not_reported","Per-mm2 densities, pooled densities, and four-marker fractions were removed because the review used selected flattened merged JPG crops rather than raw separated-channel whole-tissue images."
